{
  "contract_id": "tc_bench_p6_md_multilingual_small_text_change",
  "mode": "preservation",
  "target_scope": {
    "files": ["original.md"],
    "symbols": [],
    "sections": []
  },
  "requested_action": "Change language of the same paragraph (no structure change).",
  "allowed_delta_m": [],
  "forbidden_delta_m": [],
  "protected_elements": [],
  "output_policy": {
    "require_patch": true,
    "require_change_report": true,
    "require_uncertainty_report": true
  },
  "review_policy": {
    "preserved": "auto_approve",
    "authorized_deviation": "approve_with_note",
    "benign_incidental_drift": "approve_with_note",
    "suspicious_drift": "human_review",
    "critical_corruption": "halt"
  },
  "relation_context_ref": null,
  "metadata": {},
  "created_at": "2026-05-06T00:00:00Z"
}
