{
  "contract_id": "tc_golden_def_changed_001",
  "mode": "preservation",
  "target_scope": {
    "files": ["original.md"],
    "symbols": [],
    "sections": ["Concepts"]
  },
  "requested_action": "Improve readability while preserving all definitions and numbers.",
  "allowed_delta_m": ["sentence restructuring"],
  "forbidden_delta_m": ["definition change", "numeric change"],
  "protected_elements": ["definitions", "numbers", "headings"],
  "output_policy": {
    "require_patch": true,
    "require_change_report": true,
    "require_uncertainty_report": true
  },
  "review_policy": {
    "preserved": "auto_approve",
    "authorized_deviation": "approve_with_note",
    "benign_incidental_drift": "approve_with_note",
    "suspicious_drift": "human_review",
    "critical_corruption": "halt"
  },
  "relation_context_ref": null,
  "metadata": {},
  "created_at": "2026-05-04T00:00:00Z"
}
