{
  "contract_id": "tc_bench_p6_md_long_text_number_boundary",
  "mode": "preservation",
  "target_scope": {
    "files": ["original.md"],
    "symbols": [],
    "sections": []
  },
  "requested_action": "Stress test: adjust numeric boundary inside long text.",
  "allowed_delta_m": [],
  "forbidden_delta_m": [],
  "protected_elements": ["numbers"],
  "output_policy": {
    "require_patch": true,
    "require_change_report": true,
    "require_uncertainty_report": true
  },
  "review_policy": {
    "preserved": "auto_approve",
    "authorized_deviation": "approve_with_note",
    "benign_incidental_drift": "approve_with_note",
    "suspicious_drift": "human_review",
    "critical_corruption": "halt"
  },
  "relation_context_ref": null,
  "metadata": {},
  "created_at": "2026-05-06T00:00:00Z"
}
